{
  "schema_version": "document3.v2.2",
  "ticker": "MU",
  "policy_set_version": 12,
  "publication_state": "COMPLETE",
  "document2_ref": {
    "run_id": "init-mu-ce1a897cebf549f88d93fa485671644b-d2",
    "artifact_id": "f4c9387a22b7489eab231fa7c3a208c3",
    "sha256": "09773d307eb304b6232eb7cba1912b59a2954bb97ced27313c6007a962b57b66",
    "published_at": "2026-09-10T22:05:37.989363Z",
    "publication_state": "COMPLETE"
  },
  "event_library_ref": {
    "contract_version": "reference-view-md-v4",
    "ticker": "MU",
    "version": 25,
    "sha256": "17026b5ed3450156ff6d6f31e7edd9b52da6062edee08a14747fa0fb1cb328e6",
    "published_at": "2026-10-01T06:38:14.053200Z"
  },
  "policies": [
    {
      "policy_id": "pol_000c7e1917b14969a458",
      "title": "Micron高价值AI内存捕获转弱",
      "source_refs": [
        {
          "shell_id": "AI与服务器内存商业兑现",
          "expectation_id": "AI内存盈利持续性",
          "gap_id": "AI需求延续但Micron高价值组合份额转弱"
        },
        {
          "shell_id": "AI与服务器内存商业兑现",
          "expectation_id": "DRAM与NAND实现定价和产品组合",
          "gap_id": "AI服务器需求强但Micron高价值产品未能规模化"
        },
        {
          "shell_id": "AI与服务器内存商业兑现",
          "expectation_id": "服务器优先分配与内存行业供需",
          "gap_id": "行业价格强劲但Micron未捕获服务器优先红利"
        }
      ],
      "decision": "SHORT",
      "match_scope": "AI/服务器需求与价格保持强势时，Micron CMBU、CDBU、HBM和数据中心高价值组合的收入、份额、bit或ASP，竞争供应商HBM市场份额、验证、产能与商业发运，以及Micron资格、封装和交付瓶颈。",
      "activation_conditions": [
        {
          "condition_id": "C1",
          "criterion": "在AI/服务器行业需求和价格仍强的情况下，Micron连续两个报告窗口显示高价值AI/服务器组合指标相对当前基线下降（CMBU加CDBU占比或HBM/数据中心高价值产品阶段至少一项下降），且实现ASP或增量收入主要由消费或传统产品承担。",
          "calibration": {
            "reference_state": "FY26 Q4 Cloud Memory收入约162.83亿美元、Compute and Core Data Center收入约180.02亿美元，合计约342.85亿美元，占Q4合并收入约542.3亿美元的63.2%，高于FY26 Q3约61%；行业服务器/HBM需求与价格仍强，Q4高价值组合是当前基线。",
            "trigger_boundary": "两个连续报告窗口确认行业AI/服务器价格或需求未转弱，而上述高价值组合占比或阶段较FY26 Q4约63.2%的基线下降，并由消费/传统产品承担主要增量。"
          }
        },
        {
          "condition_id": "C2",
          "criterion": "在行业服务器/HBM需求或合同价保持强势时，Micron连续两个季度高价值产品出货或收入占比、或相关bit shipments下降，并明确归因于资格、封装或交付瓶颈。",
          "calibration": {
            "reference_state": "FY26 Q4数据中心相关业务约占合并收入63.2%，HBM收入增速超过公司总收入增速，SOCAMM收入同比翻倍以上且PCIe 6 SSD已为KV-cache应用发货；当前未披露资格、封装或交付瓶颈造成的下降。",
            "trigger_boundary": "连续两个季度的行业强势、Micron高价值占比或bit下降和公司瓶颈归因在同一可核验披露链中同时出现。"
          }
        },
        {
          "condition_id": "C3",
          "criterion": "行业服务器/HBM合同价或需求连续两个季度保持强势，而Micron CMBU/CDBU占比、相关bit shipments或实现ASP下降，并有资格、封装、晶圆或交付约束披露。",
          "calibration": {
            "reference_state": "FY26 Q4数据中心相关业务约占收入63.2%，DRAM和NAND ASP仍分别环比上涨约10%和30%，4Q26行业服务器需求与合同价仍处上涨/紧缺基线。",
            "trigger_boundary": "连续两个行业窗口保持强势且Micron接口指标至少一项下降，正式披露同时确认约束而非单纯产品组合变化。"
          }
        },
        {
          "condition_id": "C4",
          "criterion": "在AI/HBM需求与价格仍强的情况下，权威行业市场份额数据或命名AI客户/平台披露在一个可比报告期确认竞争供应商的HBM份额或主要供货地位上升，同时Micron HBM或数据中心高价值内存份额相对上一期下降，并有竞争者已验证、商业发运或已承诺产能的证据。",
          "calibration": {
            "reference_state": "截至FY2026 Q2，Counterpoint报告Micron HBM收入份额约18%，低于FY2026 Q1约21%；Samsung由约21%升至约33%，SK hynix约50%。此后Samsung已开始12层HBM4量产并推进Broadcom供货，Micron在FY26 Q4仍报告HBM收入增速高于公司总收入并与NVIDIA共同开发HBM4E；Q1至Q4的相对竞争与公司增长状态是当前基线。",
            "trigger_boundary": "在FY2026 Q2基线之后，一份可比的权威市场报告或命名客户/平台披露须同时确认Micron HBM收入份额低于约18%或相对上一可比期出现至少约3个百分点的进一步下降、竞争供应商份额或主要供货地位上升并具有验证/商业发运/已承诺产能证据，且AI/HBM需求或价格仍强。当前Q1至Q2的已知变化、单纯竞争者规划或传闻、总市场增长和Micron绝对收入增长不单独满足。"
          }
        }
      ]
    },
    {
      "policy_id": "pol_6fc4c21c7434ee04a94b",
      "title": "AI平台改用替代内存或降低配置",
      "source_refs": [
        {
          "shell_id": "AI与服务器内存商业兑现",
          "expectation_id": "HBM与AI平台商业采用",
          "gap_id": "AI平台改用替代内存或降低HBM配置"
        }
      ],
      "decision": "SHORT",
      "match_scope": "主要AI平台量产规格或持续部署中的HBM替代、容量/带宽变化及其对Micron可售内存配置的影响。",
      "activation_conditions": [
        {
          "condition_id": "C1",
          "criterion": "至少一个主要平台公开量产规格或持续部署数据确认HBM被替代，并在平台出货结构中持续反映。",
          "calibration": {
            "reference_state": "当前HBM4 36GB 12-high及Vera Rubin路线是公开配置锚，技术演示不代表量产配置。",
            "trigger_boundary": "正式量产或持续部署证据确认HBM替代方案，并在至少一个后续平台出货窗口持续存在。"
          }
        },
        {
          "condition_id": "C2",
          "criterion": "至少一个主要平台公开量产规格或持续部署数据确认单颗加速器容量或带宽低于当前36GB 12-high等公开路线，并在平台出货结构中持续反映。",
          "calibration": {
            "reference_state": "当前HBM4 36GB 12-high及Vera Rubin路线是公开配置锚，技术演示不代表量产配置。",
            "trigger_boundary": "正式量产或持续部署证据确认单颗容量或带宽低于36GB 12-high，并在至少一个后续平台出货窗口持续存在。"
          }
        }
      ]
    },
    {
      "policy_id": "pol_42dd9a8d54f851077bfd",
      "title": "高毛利被投入费用侵蚀",
      "source_refs": [
        {
          "shell_id": "AI与服务器内存商业兑现",
          "expectation_id": "AI内存盈利持续性",
          "gap_id": "高毛利被研发折旧和爬坡费用侵蚀"
        }
      ],
      "decision": "SHORT",
      "match_scope": "Micron研发、预资格、折旧、爬坡、质量或重组费用与GAAP利润转换的同季变化。",
      "activation_conditions": [
        {
          "condition_id": "C1",
          "criterion": "Micron连续两个季度GAAP毛利率仍处高位或大致稳定，但GAAP营业利润或摊薄EPS下降，且费用桥明确显示研发、预资格、折旧、爬坡、质量或重组支出增加。",
          "calibration": {
            "reference_state": "FY26 Q4 GAAP毛利率约86.8%、营业利润率约82%、GAAP摊薄EPS $32.87；公司同时计划提高FY27技术、产品和制造投入，FY27 Q1毛利率指引仍约85.95%，尚无费用驱动的利润转换恶化事实。",
            "trigger_boundary": "连续两个季度财报同时显示费用增长、GAAP营业利润或EPS下降，且毛利率未同步解释该下降，管理层费用桥明确给出上述费用原因。"
          }
        }
      ]
    },
    {
      "policy_id": "pol_4e60e33e9f3c8ced3e7a",
      "title": "FY27盈利率连续回落",
      "source_refs": [
        {
          "shell_id": "AI与服务器内存商业兑现",
          "expectation_id": "AI内存盈利持续性",
          "gap_id": "FY26 Q4达标后FY27盈利率连续回落"
        }
      ],
      "decision": "SHORT",
      "match_scope": "FY26 Q4之后连续季度的GAAP毛利率、营业利润率及由ASP、组合、供给或库存变化造成的盈利斜率。",
      "activation_conditions": [
        {
          "condition_id": "C1",
          "criterion": "在FY26 Q4达到或接近指引后，Micron FY27连续报告季度的GAAP毛利率和营业利润率均环比下降，并由实现ASP、产品组合、供给或库存转弱解释。",
          "calibration": {
            "reference_state": "FY26 Q4正式结果GAAP毛利率约86.8%、营业利润率约82%、GAAP摊薄EPS $32.87；FY27 Q1 GAAP毛利率指引约85.95%、非GAAP毛利率约86.25%，FY27盈利延续的现实基线已从Q4实际结果开始。",
            "trigger_boundary": "最新FY27季度及其可比前一季度财报同时确认GAAP毛利率和营业利润率连续下降，并明确归因于ASP、组合、供给或库存转弱。"
          }
        }
      ]
    },
    {
      "policy_id": "pol_941696a6157b4d4fe484",
      "title": "实现ASP回落且位出货无法补偿",
      "source_refs": [
        {
          "shell_id": "AI与服务器内存商业兑现",
          "expectation_id": "DRAM与NAND实现定价和产品组合",
          "gap_id": "实现ASP连续回落且位出货无法补偿"
        }
      ],
      "decision": "SHORT",
      "match_scope": "DRAM或NAND主要产品线的实现ASP、bit shipments和产品线销售额的连续季度比较。",
      "activation_conditions": [
        {
          "condition_id": "C1",
          "criterion": "至少一个主要DRAM或NAND产品线连续两个季度实现ASP环比下降，bit shipments未增长或不足以补偿每位收入下降，且该产品线销售额连续低于上一季度。",
          "calibration": {
            "reference_state": "FY26 Q4 DRAM收入约398亿美元、ASP环比上涨约10%；NAND收入约141亿美元、bit shipments环比上涨约10%、ASP环比上涨约30%。相较FY26 Q3的强劲涨幅，Q4仍为上涨但增速较低的首个现实窗口。",
            "trigger_boundary": "连续两个季度正式财报同时显示该产品线ASP环比下降、bit未增长或不能补偿ASP、销售额低于前季。"
          }
        }
      ]
    },
    {
      "policy_id": "pol_da7524bb3ec2d229d090",
      "title": "扩产阶段化和现金优先",
      "source_refs": [
        {
          "shell_id": "AI与服务器内存商业兑现",
          "expectation_id": "晶圆与先进封装扩产兑现",
          "gap_id": "需求或激励错配迫使扩产阶段化和现金优先"
        }
      ],
      "decision": "SHORT",
      "match_scope": "命名扩产阶段、AI/内存需求或价格、政府激励/客户资金条件与PPE计划和阶段排序。",
      "activation_conditions": [
        {
          "condition_id": "C1",
          "criterion": "Micron正式宣布一个命名扩产阶段在AI/内存价格或客户需求由当前强势转为下降，或政府激励/资金条件未按计划到位之后被推迟、削减或重新排序。",
          "calibration": {
            "reference_state": "FY26资本支出约270亿美元，FY27指引超过450亿美元；FY27上半年计划约250亿美元（Q1约115亿美元），下半年随建设加速而增加。Q4需求、现金流和战略客户承诺均增强，当前尚无资金条件恶化或扩产阶段重排事实。",
            "trigger_boundary": "同一正式披露同时确认需求/价格或资金条件变化与命名扩产阶段的推迟、削减或重排。"
          }
        }
      ]
    },
    {
      "policy_id": "pol_ecede39f670a0882b1f4",
      "title": "回款和客户存款改善覆盖扩产",
      "source_refs": [
        {
          "shell_id": "AI与服务器内存商业兑现",
          "expectation_id": "经营现金流与营运资本转换",
          "gap_id": "回款和客户存款同步改善并覆盖扩产现金需求"
        }
      ],
      "decision": "LONG",
      "match_scope": "收入增长、应收/DSO、客户存款或合同负债、经营现金流、发运结算和PPE支付的连续现金桥。",
      "activation_conditions": [
        {
          "condition_id": "C1",
          "criterion": "至少两个季度收入增长伴随应收余额或DSO改善、客户存款或合同负债现金增加、CFO未被同幅度营运资本吞噬，并有发运/结算配套且支持部分PPE支付。",
          "calibration": {
            "reference_state": "FY26 Q4经营现金流约439.73亿美元、调整后自由现金流约331.99亿美元，FY26全年自由现金流约623.08亿美元；FY27上半年PPE计划约250亿美元，当前单季现金转换强劲，但尚无连续两个季度的DSO与客户存款到账桥。",
            "trigger_boundary": "连续两个季度财报现金桥同时显示收入增长、回款改善、存款到账、CFO保持及PPE支持，不能只凭单季利润增长。"
          }
        }
      ]
    },
    {
      "policy_id": "pol_b669b1ffb4e2398121fd",
      "title": "客户存款受履约约束",
      "source_refs": [
        {
          "shell_id": "AI与服务器内存商业兑现",
          "expectation_id": "战略内存合同商业兑现",
          "gap_id": "客户存款到账但被交付义务和退款约束"
        }
      ],
      "decision": "SHORT",
      "match_scope": "客户存款和合同负债到账与后续发运、收入确认、应收结算及验收、交付、退款和赔付约束。",
      "activation_conditions": [
        {
          "condition_id": "C1",
          "criterion": "资产负债表显示客户存款或合同负债增加，但后续至少一个报告窗口发运、收入确认或应收结算没有相应增加，且附注明确验收、交付、退款或违约赔付限制。",
          "calibration": {
            "reference_state": "约180亿美元现金承诺与实际现金、合同负债和履约义务仍需区分，当前无对应商业结算结论。",
            "trigger_boundary": "同一或相邻报告窗口确认负债增加与交付/收入/应收不匹配，并明确资金受履约条件或退款/赔付约束。"
          }
        }
      ]
    },
    {
      "policy_id": "pol_124f1188f7bb19b420ac",
      "title": "战略内存合同履约转弱",
      "source_refs": [
        {
          "shell_id": "AI与服务器内存商业兑现",